a_url,name,url
,株式会社アクロビジョン,https://www.acrovision.jp/
,"ワークスアイディ株式会社（Works ID Co.,Ltd.）",https://www.worksid.co.jp/
,株式会社エスアイイー,https://sie.co.jp/
,株式会社夢テクノロジー,https://www.yumeteku.jp/
,株式会社富士通ゼネラルOSテクノロジー,https://www.fujitsu-general.com/jp/fgot/
,株式会社スタッフサービス エンジニアリング事業本部（リクルートグループ）,http://www.staffservice-engineering.jp
,株式会社Branding Engineer（東証マザーズ上場）,https://b-engineer.co.jp/
,"ワークスアイディ株式会社（Works ID Co.,Ltd.）",https://www.worksid.co.jp/
,ユー・アイ・ソリューションズ株式会社,https://www.ui-solutions.com
,株式会社CROSS ONE,http://www.crossone.jp/
,株式会社新生ビジネスパートナーズ,http://www.shinseibusinesspartners.com/
,株式会社C3アドバンステクノロジー,https://www.c3at.co.jp
,i.Color株式会社,http://www.i-color.co.jp
,株式会社ビジネクスト,https://www.busi-next.com/
,東海興業株式会社,http://www.tokaikogyo.co.jp/
,株式会社アーシャルデザイン,https://www.a-cial.com/
,アドバンステクノロジー株式会社,http://www.advance-te.com/
,株式会社リーディ,https://ridi.co.jp/
,AppTime株式会社,https://apptime.co.jp/
,シスネット株式会社,
,株式会社新都市情報システム,http://shintoshi-systems.co.jp/
,住友化学株式会社（東証一部上場）,https://www.sumitomo-chem.co.jp/
,株式会社クルーズ,http://www.cruise-net.co.jp/
,株式会社BTM,http://www.b-tm.co.jp
,株式会社宇部情報システム,https://www.uis-inf.co.jp
,株式会社日立ソリューションズ,https://www.hitachi-solutions.co.jp/
,住化ロジスティクス株式会社,https://www.sumika-logi.co.jp/index.html
,株式会社ビスカス,https://www.viscas.co.jp/
,株式会社ファンコミュニケーションズ（東証一部上場）,http://www.fancs.com/
,佐野器械株式会社,http://sanomed.co.jp
,岡田装飾金物株式会社,https://os-rail.co.jp/
,株式会社サンビット,https://sun-bit.co.jp/
,株式会社ぐるなび（東証一部上場）,http://www.gnavi.co.jp/company/
,メタルテック株式会社,https://www.metaltech.co.jp/index.html
,株式会社フューチャーショップ,https://www.future-shop.jp/corporate/
,株式会社ダイサン（東証二部上場）,http://www.daisan-g.co.jp
,株式会社ブルックス,http://www.brooks.co.jp
,株式会社シノケングループ（東証JASDAQ上場）,https://www.shinoken.co.jp/
,株式会社ネクソン（東証一部上場）,http://company.nexon.co.jp/
,株式会社ネクソン（東証一部上場）,http://company.nexon.co.jp/
,株式会社ハイマックス（東証一部上場）,https://www.himacs.jp/
,株式会社ハイマックス（東証一部上場）,https://www.himacs.jp/
,株式会社ラクス（東証マザーズ上場）,http://www.rakus.co.jp/
,株式会社ラクス（東証マザーズ上場）,http://www.rakus.co.jp/
,株式会社セットアップ,http://www.setup-jp.com/index.html
,株式会社タイテック,
,株式会社サイバーセキュリティクラウド（東証マザーズ上場）,https://www.cscloud.co.jp
,株式会社パートナー,http://www.go-partner.jp/index.html
,株式会社テラスカイ（東証一部上場）,https://www.terrasky.co.jp/
